{
  "schema_version": "2.0.0",
  "simulation": true,
  "source_snapshot_id": "SIMULATED-qwen7-pressure-v2",
  "selected_plan_id": null,
  "candidate_count": 56,
  "memory_feasible_count": 15,
  "candidates": [
    {
      "schema_version": "2.0.0",
      "plan_id": "candidate-686c50d510196f36",
      "source_snapshot_id": "SIMULATED-qwen7-pressure-v2",
      "model_id": "mlx-community/Qwen2.5-7B-Instruct-4bit",
      "model_revision": "SIMULATED-NOT-A-MODEL-LOCK",
      "profile_id": "SIMULATED-weight-profile-v2",
      "simulation": true,
      "selected": false,
      "policy": "candidate_only",
      "mode": "single_device",
      "logical_split": [
        28
      ],
      "mlx_split_by_rank": [
        28
      ],
      "device_id_by_mlx_rank": [
        "SIMULATED-m4-pressure"
      ],
      "assignments": [
        {
          "device_id": "SIMULATED-m4-pressure",
          "logical_stage": 0,
          "mlx_rank": 0,
          "start_layer": 0,
          "end_layer_exclusive": 28,
          "layer_count": 28,
          "memory_components": {
            "layer_weight_bytes": 3758096384,
            "replicated_weight_bytes": 1073741824,
            "kv_upper_bound_bytes": 66060288,
            "workspace_reserve_bytes": 536870912,
            "safety_margin_bytes": 536870912
          },
          "predicted_memory_bytes": 5971640320,
          "safe_process_budget_bytes": 3221225472,
          "headroom_bytes": -2750414848
        }
      ],
      "memory_feasible": false,
      "rejection_reasons": [
        {
          "code": "MEMORY_BUDGET_EXCEEDED",
          "device_id": "SIMULATED-m4-pressure",
          "excess_bytes": 2750414848
        }
      ],
      "runtime_verified": false,
      "executable": false
    },
    {
      "schema_version": "2.0.0",
      "plan_id": "candidate-7cb504ce3de7854e",
      "source_snapshot_id": "SIMULATED-qwen7-pressure-v2",
      "model_id": "mlx-community/Qwen2.5-7B-Instruct-4bit",
      "model_revision": "SIMULATED-NOT-A-MODEL-LOCK",
      "profile_id": "SIMULATED-weight-profile-v2",
      "simulation": true,
      "selected": false,
      "policy": "candidate_only",
      "mode": "single_device",
      "logical_split": [
        28
      ],
      "mlx_split_by_rank": [
        28
      ],
      "device_id_by_mlx_rank": [
        "SIMULATED-second-mac"
      ],
      "assignments": [
        {
          "device_id": "SIMULATED-second-mac",
          "logical_stage": 0,
          "mlx_rank": 0,
          "start_layer": 0,
          "end_layer_exclusive": 28,
          "layer_count": 28,
          "memory_components": {
            "layer_weight_bytes": 3758096384,
            "replicated_weight_bytes": 1073741824,
            "kv_upper_bound_bytes": 66060288,
            "workspace_reserve_bytes": 536870912,
            "safety_margin_bytes": 536870912
          },
          "predicted_memory_bytes": 5971640320,
          "safe_process_budget_bytes": 25769803776,
          "headroom_bytes": 19798163456
        }
      ],
      "memory_feasible": true,
      "rejection_reasons": [],
      "runtime_verified": false,
      "executable": false
    },
    {
      "schema_version": "2.0.0",
      "plan_id": "candidate-bfa599b48584765b",
      "source_snapshot_id": "SIMULATED-qwen7-pressure-v2",
      "model_id": "mlx-community/Qwen2.5-7B-Instruct-4bit",
      "model_revision": "SIMULATED-NOT-A-MODEL-LOCK",
      "profile_id": "SIMULATED-weight-profile-v2",
      "simulation": true,
      "selected": false,
      "policy": "candidate_only",
      "mode": "pipeline",
      "logical_split": [
        1,
        27
      ],
      "mlx_split_by_rank": [
        27,
        1
      ],
      "device_id_by_mlx_rank": [
        "SIMULATED-second-mac",
        "SIMULATED-m4-pressure"
      ],
      "assignments": [
        {
          "device_id": "SIMULATED-m4-pressure",
          "logical_stage": 0,
          "mlx_rank": 1,
          "start_layer": 0,
          "end_layer_exclusive": 1,
          "layer_count": 1,
          "memory_components": {
            "layer_weight_bytes": 134217728,
            "replicated_weight_bytes": 1073741824,
            "kv_upper_bound_bytes": 2359296,
            "workspace_reserve_bytes": 536870912,
            "safety_margin_bytes": 536870912
          },
          "predicted_memory_bytes": 2284060672,
          "safe_process_budget_bytes": 3221225472,
          "headroom_bytes": 937164800
        },
        {
          "device_id": "SIMULATED-second-mac",
          "logical_stage": 1,
          "mlx_rank": 0,
          "start_layer": 1,
          "end_layer_exclusive": 28,
          "layer_count": 27,
          "memory_components": {
            "layer_weight_bytes": 3623878656,
            "replicated_weight_bytes": 1073741824,
            "kv_upper_bound_bytes": 63700992,
            "workspace_reserve_bytes": 536870912,
            "safety_margin_bytes": 536870912
          },
          "predicted_memory_bytes": 5835063296,
          "safe_process_budget_bytes": 25769803776,
          "headroom_bytes": 19934740480
        }
      ],
      "memory_feasible": true,
      "rejection_reasons": [],
      "runtime_verified": false,
      "executable": false
    },
    {
      "schema_version": "2.0.0",
      "plan_id": "candidate-37b454254a078ae4",
      "source_snapshot_id": "SIMULATED-qwen7-pressure-v2",
      "model_id": "mlx-community/Qwen2.5-7B-Instruct-4bit",
      "model_revision": "SIMULATED-NOT-A-MODEL-LOCK",
      "profile_id": "SIMULATED-weight-profile-v2",
      "simulation": true,
      "selected": false,
      "policy": "candidate_only",
      "mode": "pipeline",
      "logical_split": [
        2,
        26
      ],
      "mlx_split_by_rank": [
        26,
        2
      ],
      "device_id_by_mlx_rank": [
        "SIMULATED-second-mac",
        "SIMULATED-m4-pressure"
      ],
      "assignments": [
        {
          "device_id": "SIMULATED-m4-pressure",
          "logical_stage": 0,
          "mlx_rank": 1,
          "start_layer": 0,
          "end_layer_exclusive": 2,
          "layer_count": 2,
          "memory_components": {
            "layer_weight_bytes": 268435456,
            "replicated_weight_bytes": 1073741824,
            "kv_upper_bound_bytes": 4718592,
            "workspace_reserve_bytes": 536870912,
            "safety_margin_bytes": 536870912
          },
          "predicted_memory_bytes": 2420637696,
          "safe_process_budget_bytes": 3221225472,
          "headroom_bytes": 800587776
        },
        {
          "device_id": "SIMULATED-second-mac",
          "logical_stage": 1,
          "mlx_rank": 0,
          "start_layer": 2,
          "end_layer_exclusive": 28,
          "layer_count": 26,
          "memory_components": {
            "layer_weight_bytes": 3489660928,
            "replicated_weight_bytes": 1073741824,
            "kv_upper_bound_bytes": 61341696,
            "workspace_reserve_bytes": 536870912,
            "safety_margin_bytes": 536870912
          },
          "predicted_memory_bytes": 5698486272,
          "safe_process_budget_bytes": 25769803776,
          "headroom_bytes": 20071317504
        }
      ],
      "memory_feasible": true,
      "rejection_reasons": [],
      "runtime_verified": false,
      "executable": false
    },
    {
      "schema_version": "2.0.0",
      "plan_id": "candidate-67c106d723b41e90",
      "source_snapshot_id": "SIMULATED-qwen7-pressure-v2",
      "model_id": "mlx-community/Qwen2.5-7B-Instruct-4bit",
      "model_revision": "SIMULATED-NOT-A-MODEL-LOCK",
      "profile_id": "SIMULATED-weight-profile-v2",
      "simulation": true,
      "selected": false,
      "policy": "candidate_only",
      "mode": "pipeline",
      "logical_split": [
        3,
        25
      ],
      "mlx_split_by_rank": [
        25,
        3
      ],
      "device_id_by_mlx_rank": [
        "SIMULATED-second-mac",
        "SIMULATED-m4-pressure"
      ],
      "assignments": [
        {
          "device_id": "SIMULATED-m4-pressure",
          "logical_stage": 0,
          "mlx_rank": 1,
          "start_layer": 0,
          "end_layer_exclusive": 3,
          "layer_count": 3,
          "memory_components": {
            "layer_weight_bytes": 402653184,
            "replicated_weight_bytes": 1073741824,
            "kv_upper_bound_bytes": 7077888,
            "workspace_reserve_bytes": 536870912,
            "safety_margin_bytes": 536870912
          },
          "predicted_memory_bytes": 2557214720,
          "safe_process_budget_bytes": 3221225472,
          "headroom_bytes": 664010752
        },
        {
          "device_id": "SIMULATED-second-mac",
          "logical_stage": 1,
          "mlx_rank": 0,
          "start_layer": 3,
          "end_layer_exclusive": 28,
          "layer_count": 25,
          "memory_components": {
            "layer_weight_bytes": 3355443200,
            "replicated_weight_bytes": 1073741824,
            "kv_upper_bound_bytes": 58982400,
            "workspace_reserve_bytes": 536870912,
            "safety_margin_bytes": 536870912
          },
          "predicted_memory_bytes": 5561909248,
          "safe_process_budget_bytes": 25769803776,
          "headroom_bytes": 20207894528
        }
      ],
      "memory_feasible": true,
      "rejection_reasons": [],
      "runtime_verified": false,
      "executable": false
    },
    {
      "schema_version": "2.0.0",
      "plan_id": "candidate-f8b97474add30257",
      "source_snapshot_id": "SIMULATED-qwen7-pressure-v2",
      "model_id": "mlx-community/Qwen2.5-7B-Instruct-4bit",
      "model_revision": "SIMULATED-NOT-A-MODEL-LOCK",
      "profile_id": "SIMULATED-weight-profile-v2",
      "simulation": true,
      "selected": false,
      "policy": "candidate_only",
      "mode": "pipeline",
      "logical_split": [
        4,
        24
      ],
      "mlx_split_by_rank": [
        24,
        4
      ],
      "device_id_by_mlx_rank": [
        "SIMULATED-second-mac",